tanda_id,label,notes,source,track_1_id,track_1_title,track_1_year,track_1_orchestra,track_2_id,track_2_title,track_2_year,track_2_orchestra,track_3_id,track_3_title,track_3_year,track_3_orchestra,track_4_id,track_4_title,track_4_year,track_4_orchestra
good_001,excellent,"smooth walking, melodic consistency, low risk",heuristic_seed_not_ground_truth,1e7fe404552f,Catamarca,1940,Carlos Di Sarli,651e27bbf6c9,Cosas Olvidadas,1940,Carlos Di Sarli,16305e07eb79,El Incendio,1940,Carlos Di Sarli,4ada589ac0bd,El Jaguar,1940,Carlos Di Sarli
good_002,excellent,"rhythmic golden-age tanda, strong floor activation",heuristic_seed_not_ground_truth,5c3427397c7f,Ataniche,1936,Juan D'Arienzo,fbe5ca2897fa,Comme Il Faut,1936,Juan D'Arienzo,b5463f31c143,Don Esteban,1936,Juan D'Arienzo,dd9aea637b56,Don Juan,1936,Juan D'Arienzo
good_003,good,"social vocal tanda, accessible energy",heuristic_seed_not_ground_truth,b8ba0331cded,Adiós Pueblo,1941,Ricardo Tanturi,4a30f5dd9545,Comparsa Criolla (Comme Il Faut),1941,Ricardo Tanturi,96791cd1a4f5,Didí,1941,Ricardo Tanturi,c4b20a333f0b,El Buey Solo,1941,Ricardo Tanturi
good_004,good,"accessible vals tanda, social floor friendly",heuristic_seed_not_ground_truth,f9b02cc9877e,Aclamación,1935,Francisco Canaro,7ef5b1fc2855,Amor y Primavera,1935,Francisco Canaro,147b6a2b144a,Los Patinadores,1935,Francisco Canaro,97d6448e1f1d,No Nos Veremos Mas,1935,Francisco Canaro
bad_001,risky,same orchestra but excessive dramatic density; late-night expert crowd only,heuristic_seed_not_ground_truth,54f5b45149c3,Adiós Bardi,1944,Osvaldo Pugliese,41bfa62edbe0,Amurado,1944,Osvaldo Pugliese,4d3e1881d795,Corrientes y Esmeralda,1944,Osvaldo Pugliese,69e6baa497ce,El Arranque,1944,Osvaldo Pugliese
bad_002,risky,same orchestra but possible high-energy fatigue if placed too early or after another strong tanda,heuristic_seed_not_ground_truth,5c3427397c7f,Ataniche,1936,Juan D'Arienzo,fbe5ca2897fa,Comme Il Faut,1936,Juan D'Arienzo,b5463f31c143,Don Esteban,1936,Juan D'Arienzo,dd9aea637b56,Don Juan,1936,Juan D'Arienzo
bad_003,bad,mixed orchestra example; breaks tanda identity,heuristic_seed_not_ground_truth,fbe4ebe9665c,Acordate Lo Que Fuiste,1928,Juan D'Arienzo,ce45a95e4759,El Rodeo,1943,Osvaldo Pugliese,7cbd9a731180,La Guitarrita,1928,Carlos Di Sarli,f1587e810f3e,El Incendio,1938,Rodolfo Biagi
